{
  "$schema": "../.harness/schemas/workflow-state.schema.json",
  "workflowId": "workflow-plan-010-v1",
  "activePlanRef": null,
  "activeTaskId": null,
  "workflowStatus": "archived",
  "currentPhase": "archiving",
  "ownerRole": "developer",
  "nextAction": "开启下一个 workflow",
  "updatedAt": "2026-04-28T10:43:34+08:00"
}
